show_title,imdb_rating,release_year,runtime,genre,parental_guideline,imdb_votes,synopsis
Godzilla: The Series,6.8,1998-2001,30,"Animation, Action, Crime",TV-Y7,"2,408","In this direct sequel to the 1998 Godzilla movie, Dr. Nico Tatopoulos leads a team, known as H.E.A.T, to battle giant monsters with the help of Godzilla's only living offspring."
A Pup Named Scooby-Doo,6.8,1988-1991,30,"Animation, Adventure, Comedy",TV-G,"5,171","A pre-teen version of Scooby Doo, with a pint-sized version of the title character."
RoboCop: Prime Directives,4.7,2001,375,"Action, Crime, Sci-Fi",R,"2,563","Thirteen years after the original Robocop, Delta City, considered to be ""The Safest Place On Earth!"", has become a futuristic city owned and operated by OCP, and RoboCop, Alex Murphy has ... See full summary »"
Transformers: Robots in Disguise,6,2014-2020,22,"Animation, Action, Adventure",TV-Y7,"1,025","When a new army of Decepticons appear, Bumblebee must lead a new team of Autobots to Earth against their eternal foes."
Battle of the Planets,7.6,1978-1980,30,"Animation, Action, Adventure",TV-Y7,"1,948",A five-member superhero team called G-Force fights to defend Earth and its space colonies from the threat of the planet Spectra.
Green Lantern: The Animated Series,8,2011-2013,25,"Animation, Action, Adventure",TV-PG,"6,631",The further adventures of Hal Jordan and his comrades of the Green Lantern Corps.
Frisky Dingo,8.1,2006-2008,11,"Animation, Comedy, Sci-Fi",TV-MA,"7,255","A philandering billionaire playboy who moonlights as the superhero, Awesome X, faces against his greatest adversary, Killface, but finds balancing his business and superhero lives difficult."
Max Steel,6.7,2000-2015,23,"Animation, Action, Adventure",TV-Y7-FV,"1,091","Now it's all up to Max. Can he infiltrate the Pantheon, find a cure that will restore Alex's humanity, free Rayne and Cytro, defeat the army of Terror Energy powered minions, and stop Terrorax once and for all?"
Witchblade,7.1,2006,,"Animation, Action, Adventure",TV-MA,"1,415","In order to protect her daughter, a young single mother is forced to fight after acquiring a powerful ancient weapon."
M.A.N.T.I.S.,6.4,1994-1995,60,"Action, Sci-Fi",TV-G,733,"A paralyzed African-American scientist builds a powerful exo-skeleton in order to walk again, and uses his new abilities to fight crime."
Justice League Action,7.6,2016-2018,11,"Animation, Action, Adventure",TV-Y7,"2,019","Batman, Superman and Wonder Woman will lead the DC Super Heroes against their most infamous foes."
V.R. Troopers,5.8,1994-1996,30,"Action, Adventure, Family",TV-Y7,"1,023","A trio of teenagers gain powers from ""Virtual Reality"" to fight the evil forces of Grimlord."
New Warriors,Not-Rated,TBA,30,"Action, Adventure, Comedy",,,The adventures of a team of teenage superheroes.
Bravest Warriors,8,2012-2018,5,"Animation, Action, Adventure",TV-PG,"3,419",Four teenage heroes-for-hire warp through the universe to save adorable aliens and their worlds using the power of their emotions.
The Mask,7,1995-1997,30,"Animation, Short, Action",TV-Y7,"12,392",The further adventures of Stanley Ipkiss (Rob Paulsen) and his magic reality defying mask.
The Middleman,8.1,2008,43,"Comedy, Drama, Sci-Fi",TV-14,"2,973",A struggling artist is recruited by a secret agency to fight against evil forces. Based on the graphic novels by Javier Grillo-Marxuach and Les McClaine.
Captain Power and the Soldiers of the Future,7.6,1987-1988,30,"Action, Sci-Fi",Not Rated,"1,283",A group of guerilla fighters battle the evil machine forces that dominate a future Earth.
Krypto the Superdog,5.8,2005-2006,30,"Animation, Action, Adventure",TV-Y,"1,063",The adventures of the Kryptonian superhero dog and his friends.
Zero,5.6,2021,27,"Action, Comedy, Drama",TV-MA,"1,233","A teen with the power of invisibility is dragged into a small-time criminal's quest to rule the neighborhood, and gets to know a mysterious art student."
Stingray,7.5,1985-1989,48,"Crime, Drama, Mystery",TV-14,782,"""Ray"", a man of mystery, gets people out of trouble, asking for favors in return."
Transformers: Rescue Bots,6.5,2011-2016,20,"Animation, Short, Action",TV-Y7,900,The Rescue Bots are Transformers that work with a family of heroes to rescue humans from disasters. These non-violent Transformer stories were aimed at pre-school viewers.
The Crow: Stairway to Heaven,6.5,1998-1999,43,"Action, Crime, Drama",,"2,431","A deceased street musician returns to life, and must restore the balance between good and evil to be reunited with his dead girlfriend."
Transformers: Animated,6.6,2007-2009,20,"Animation, Action, Family",TV-Y7,"2,164",Transformers crash land on present day Earth and inadvertently cause a technological revolution. They wake up 50 years later in a world where robots are used in everyday life. StarScream arrives looking for their AllSpark.
BeetleBorgs,6.4,1996-1998,23,"Action, Adventure, Comedy",TV-Y7,"1,296",Their wish to become comic book heroes forces three kids to take on the heroes' mortal enemies.
The Girl from U.N.C.L.E.,6.9,1966-1967,60,"Action, Adventure, Comedy",,451,The missions of agent April Dancer of the United Network Command for Law and Enforcement.
Sonic Underground,6.1,1999-2000,30,"Animation, Short, Action",TV-Y7,"2,869","Sonic and his royal siblings seek to find their mother and defeat the tyrant, Robotnik."
Mighty Ducks: The Animated Series,6.5,1996-1997,30,"Animation, Short, Action",TV-Y7,"1,882",A team of humanoid duck ice hockey team/freedom fighters fight evil between games.
Jake 2.0,6.8,2003-2004,60,"Drama, Sci-Fi",,"3,596","Jake Foley is a computer technician for the N.S.A., who secretly longs for a chance to work in the field. Circumstance puts him in a top secret laboratory, in the middle of a shoot-out ... See full summary »"
Sym-Bionic Titan,8.1,2010-2011,,"Animation, Action, Adventure",TV-PG,"2,640","Three young alien beings with the ability to form a giant robotic warrior attempt to blend into suburbia, all while battling the tyrannical forces that ravaged their home world."
Fantastic Four: The Animated Series,6.5,1994-1996,22,"Animation, Action, Sci-Fi",,"3,435",The adventures of Marvel Comic's greatest superhero team.
Spider-Man,7,1981-1982,30,"Animation, Action, Adventure",TV-Y7,"1,458",The web slinging superhero battles crime in New York City.
Bibleman,3.1,1995- ,,"Family, Sci-Fi",TV-Y7,785,"Miles Peterson had everything: Money, power, fame...Until he lost it. Then Miles finds the power of God and harnesses that power to become Bibleman."
Ewoks,6,1985-1987,30,"Animation, Adventure, Family",TV-G,"1,890","A stand-alone collection of stories, Star Wars Ewoks focuses on the fur-balls from Return of the Jedi and their many misadventures into the unknown, the magical and downright absurd. So is the life of an Ewok."
Adventures of Sonic the Hedgehog,6.4,1993,30,"Animation, Short, Action",TV-Y,"3,678","A blue hedgehog that can run at incredible speeds, his best friend, a two-tailed flying fox, defend planet Mobius from the evil Dr. Robotnik and his bumbling mechanical goons."
Randy Cunningham: 9th Grade Ninja,6.6,2012-2015,15,"Animation, Short, Action",TV-G,"1,165",An ordinary ninth grader is chosen to become The Ninja. He is tasked with protecting the town from evil as well as balancing his school life with friends and homework.
Deadpool,5.5,2013,11,"Action, Comedy, Fantasy",,491,Deadpool is hired and smitten by the enigmatically psychotic Typhoid Mary. But who is his target?
ThunderCats Roar,2,2020,11,"Animation, Action, Comedy",TV-Y7-FV,"2,309","This upcoming Cartoon Network series centers around Lion-O and his wacky misadventures, as he tries to defeat the evil Mumm-Ra."
Dead Boy Detectives,Not-Rated,TBA,,"Action, Adventure, Comedy",,,"Follows Charles Rowland and Edwin Paine, who decided not to enter the afterlife to stay on earth and investigate crimes that involve supernatural stuff."
Batwheels,,2022- ,,"Animation, Action, Adventure",TV-Y7,,"Superpowered crime-fighting vehicles defending Gotham City alongside Batman, Robin, Batgirl and a host of DC superheroes. Having just been created by the Batcomputer, our heroes are essentially kids with little to no life experience."
Popeye the Sailor,7.1,1960-1962,30,"Animation, Adventure, Comedy",TV-G,"11,659","The continuing animated adventures of Olive Oyl, Wimpy, Swee'pea and Popeye."
Robotech,8.5,1985,30,"Animation, Action, Adventure",TV-Y7,"3,632",An alien spaceship crash lands on Earth and the technology and secrets she bears lead Earth into three destructive interplanetary wars.
Power Rangers Operation Overdrive,5.5,2007,22,"Action, Adventure, Sci-Fi",TV-Y7,"1,375","Five teenagers must locate and secure ancient relics with unbelievable power, while at the same time stop a demonic corporation who want the relics for their power."
Hong Kong Phooey,6.9,1974-1975,22,"Animation, Action, Adventure",TV-G,"3,523",A kung-fu-fighting pup and his snickering cat sidekick battle crime.
My Adventures with Superman,Not-Rated,TBA,,"Animation, Action, Adventure",,,"Clark Kent builds his secret Superman identity and embraces his role as the hero of Metropolis, while sharing adventures and falling in love with Lois, a star investigative journalist, who also takes Jimmy Olsen under her wing."
Power Rangers Turbo,5.7,1997-1998,30,"Action, Adventure, Family",TV-Y7,"2,358",Divatox has begun her invasion on Earth and the Power Rangers trade in their Zeo crystal powers for Turbo technology powers to combat this new threat.
Ninja Turtles: The Next Mutation,4.5,1997-1998,20,"Action, Adventure, Comedy",TV-Y7,"1,531","""the heroes in a half-shell"" return to stop the evil Dragonlord with help from their newest member, Venus DiMilo."
Scooby-Doo and Scrappy-Doo,6.4,1979-1983,30,"Animation, Adventure, Comedy",TV-G,"3,920",The adventures of the mystery solving dog and his nephew.
Duck Dodgers,7.7,2003-2005,30,"Animation, Short, Action",TV-Y7,"7,162","Animated science fiction series based on the alter ego of Looney Tunes star Daffy Duck, the semi-heroic, yet incompetent, space Captain Duck Dodgers."
Swat Kats: The Radical Squadron,8.4,1993-1995,22,"Animation, Action, Family",TV-PG,"4,298","In a world of anthropomorphic felines, two demoted fighter pilots battle evil as high flying masked vigilantes."
Hulk and the Agents of S.M.A.S.H.,6.1,2013-2015,23,"Animation, Action, Adventure",TV-Y7,"2,954","The Incredible Hulk teams up with Red Hulk, She-Hulk, Skaar, and Rick Jones aka A-Bomb to battle the forces of evil in front of cameras for Rick's web-based series to show the Hulk is more hero than monster."
Powerpuff Girls Z,5.3,2006-2019,,"Animation, Action, Adventure",,537,Three ordinary girls gain superpowers and protect their home city from a variety of villains.
The Highwayman,6.6,1987-1988,60,"Action, Sci-Fi",,447,"Series starring a big high-tech 18-wheeler. The driver, the title's 'Highwayman' was one of a team of federal marshals empowered to right wrongs ""where ordinary laws do not reach"" - and to ... See full summary »"
Swamp Thing,6.5,1990-1993,30,Sci-Fi,,929,"When an attempt on Dr. Alec Holland's life leaves him consumed by deadly chemicals and fire, the swamps of Louisiana transform him into a superhuman creature hell-bent on ridding the swamp--and the world--of the evil that men do."
Power Rangers Lightspeed Rescue,6.5,2000-2001,30,"Action, Adventure, Drama",TV-Y7,"1,876",Five young adults are recruited by the Lightspeed Rescue organization to protect the city of Marnier Bay from the forces of evil.
Johnny Test,6.9,2021- ,,"Animation, Action, Comedy",TV-Y7,303,"Johnny Test has exciting adventures with his genetically-engineered superdog, Dukey, and his science-loving sisters, Susan and Mary."
Silverhawks,7.3,1986- ,23,"Action, Sci-Fi, Family",TV-Y7,"3,073",A team of cyborgs protects Limbo from Mon Star and his gang.
The Super Hero Squad Show,6.1,2009-2011,,"Animation, Action, Comedy",TV-Y7,"1,752","Marvel's greatest heroes and evilest of villains battle it out in action packed, yet somewhat satirical alternate universe-style adventures."
Biker Mice from Mars,7,1993-1996,30,"Animation, Action, Adventure",TV-Y7,"4,462","When three alien motorcycle riding mice are forced to leave their home planet of Mars thanks to the evil mining Plutarkians, they rebel against their enemies on planet Earth and the city of Chicago."
Kamen Rider Revice,8.2,2021-2022,25,"Action, Adventure, Comedy",TV-PG,73,"Deadmans is an organization that worships demons. Through the use of mysterious Vistamps, monsters called Deadman are born from within humans. Fighting to protect his family from Deadmans' ... See full summary »"
"Sabrina, the Animated Series",5.9,1999-2000,30,"Animation, Comedy, Family",TV-Y,"3,445",Short lived animated spin off of the television series Sabrina the Teenage Witch. The animated series is a prequel which features Sabrina as a pre-teen girl with small witch powers. Also ... See full summary »
Megas XLR,8.2,2004-2005,30,"Animation, Short, Action",TV-Y7-FV,"5,714",Two teenage slackers find a mecha from the future that had been lying in a New Jersey junkyard for nearly 60 years and make modifications much to the dismay of the robot's attractive creator.
Jason of Star Command,6.5,1978-1981,30,"Action, Adventure, Family",,358,A young Space Command officer fights the evil space lord Dragos and his minions in his jurisdiction of the universe.
DC Super Hero Girls,6,2015-2018,3,"Animation, Short, Action",TV-Y7,702,"At Super Hero High, iconic super heroes like Wonder Woman, Supergirl, Batgirl, Harley Quinn, Bumblebee, Poison Ivy, and Katana navigate all the twists and turns of high school."
The Real Adventures of Jonny Quest,7.7,1996-1997,21,"Animation, Action, Adventure",TV-PG,"2,485",A teenager and his extended family investigate the supernatural and other mysteries around the world.
The Invisible Man,6.7,1975-1976,60,"Adventure, Sci-Fi, Thriller",,875,"The weekly adventures of Dr. Daniel Westin, an invisible scientist working as an agent for a private thinktank."
ReBoot: The Guardian Code,3.8,2018,30,"Action, Comedy, Drama",TV-Y7-FV,"1,188",Four teenagers are recruited by an AI to help protect both cyberspace and the real world.
El Deafo,8.2,2022- ,25,"Animation, Adventure, Comedy",TV-G,69,Follows a kid as she loses her hearing and finds her inner superhero.
The Neighbor,6.6,2019-2021,30,"Action, Comedy",,"2,109","Javier is going through a bad patch: he can hardly make it to the end of the month, his business of T-shirts with de-motivational slogans is not quite getting the attention, and his ... See full summary »"
Space Ghost,7.3,1966-1968,30,"Animation, Action, Adventure",TV-Y7,"1,767",The adventures of a space superhero who can become invisible and his sidekicks.
Super Why!,6.1,2007-2016,30,"Animation, Family",TV-Y,826,A group of characters who live at a library turn into superheroes and then go into books; using early reading skills to save the day. They later use a problem from the story one of them faced and apply it to their own lives.
Underdog,7.2,1964-1973,,"Animation, Action, Adventure",TV-G,"2,348",The adventures of a rhyming canine superhero.
Captain Scarlet and the Mysterons,7.8,1967-1968,25,"Animation, Action, Family",TV-PG,"1,629","In 2068, the indestructible Captain Scarlet leads the agents of Spectrum in a war of nerves against the Mysterons from Mars."
Aaron Stone,6.7,2009-2010,,"Action, Adventure, Family",TV-Y7,932,"Sixteen-year old Charlie Landers is a legend in the online video game world. Via his avatar, Aaron Stone, Charlie is the best player in the world at the video game, Hero Rising. His life is... See full summary »"
The Krofft Supershow,7.5,1976-1978,,"Family, Fantasy, Sci-Fi",,186,An anthology of live-action fantasy/adventure shows hosted by musical group Kaptain Kool and the Kongs.
The Rocketeer,5.1,2019-2020,,"Animation, Short, Action",TV-Y,166,"A girl inherits the persona of The Rocketeer, and with the help of her gadget-building friend they tackle epic adventures."
Legion of Super Heroes,7.1,2006-2008,,"Animation, Action, Comedy",Not Rated,"1,528","The adventures of a young Clark Kent, as Superman, during his time with a team of teenage superheroes in the far future."
Ultraman: A Special Effects Fantasy Series,7.9,1965-1967,30,"Action, Adventure, Comedy",TV-14,712,A human member of a defense force is given the life and ability to change into a giant super-hero to battle the monsters that wreaks havoc on Earth.
Spy Kids: Mission Critical,5.1,2018- ,,"Animation, Action, Adventure",TV-Y7-FV,369,"The series centers around brother and sister team Juni and Carmen Cortez as they attend Spy Kids Academy, a top secret spy school for kid agents. When a new counter-spy agency threatens the... See full summary »"
Rambo,6.4,1986,30,"Animation, Action, Adventure",TV-Y7,685,"On Colonel Trautman's request, John Rambo leads special unit The Force of Freedom against paramilitary terrorist organization S.A.V.A.G.E. (Specialist-Administrators of Vengeance, Anarchy and Global Extortion) all over the globe."
Street Sharks,6.3,1994-1996,22,"Animation, Action, Adventure",TV-Y7,"2,585","Ripster, Jab, Streex and Slammu must protect their reputations and change the way they are being viewed in Fission City. They must fight Dr. Piranoid as well as finding their father once and for all..."
The Legend of Tarzan,6.8,2001-2003,22,"Animation, Action, Adventure",TV-Y,"2,962",The further adventures of the jungle hero Tarzan (1999) and his friends.
Blood+,7.6,2005-2006,,"Animation, Action, Adventure",TV-MA,"4,494","In present day Okinawa, a young amnesiac girl named Saya combats vicious, shape-shifting vampires. Her adoptive family and friends help her track down their source and uncover her past."
¡Mucha Lucha!,5.8,2002-2005,22,"Animation, Short, Action",TV-Y7-FV,"2,836",The Story of three masked wrestlers in Wrestling school.
Fantastic Four: World's Greatest Heroes,6.8,2006-2010,30,"Animation, Action, Family",TV-Y7,"2,344",The adventures of the Marvel Universe's premiere superhero family.
Monsters vs. Aliens,5.8,2013-2014,15,"Animation, Short, Action",TV-Y7,"1,197",The further adventures of Susan and her monster friends as they defend Earth from various alien and supernatural threats.
El Tigre: The Adventures of Manny Rivera,6.3,2007-2008,,"Animation, Short, Action",TV-Y7,"1,718","The daily adventures of a 12 year old Mexican superhero dealing with bizarre enemies, as well as his own superhero father and villain grandfather."
The Legend of Zelda,6.3,1989,15,"Animation, Action, Adventure",TV-Y7-FV,"1,598","Based on the popular Nintendo game of the same name. Link and Princess Zelda protect the mystical artifact, the Triforce of Wisdom, from falling into the hands of the evil sorcerer Ganon."
Action Pack,6.3,2022- ,29,"Animation, Action, Adventure",TV-Y,60,"Follows a group of kids who use their super powers to implement lessons and bring out the good in everything, even in villains."
Thundarr the Barbarian,7.5,1980-1981,30,"Animation, Action, Adventure",TV-Y7,"1,466",Thundarr the Barbarian and his companions Ookla the Mok and Princess Ariel wander a devastated future Earth and fight evil wherever they find it.
Penn Zero: Part-Time Hero,7.2,2014-2017,22,"Animation, Adventure, Comedy",TV-Y7,"1,989",Penn Zero is not your average kid - every day he's zapped into another dimension with his friends to save the world.
Marvel's Moon Girl and Devil Dinosaur,,2022- ,,"Animation, Action, Adventure",TV-Y7,,"After 13-year-old super-genius Lunella accidentally brings ten-ton T-Rex, Devil Dinosaur into present-day New York City via a time vortex, the duo works together to protect the city's Lower East Side from danger."
Grendel,Not-Rated,TBA,,"Action, Adventure, Crime",,,"Follows a gifted fencer, writer and assassin, seeking to avenge the death of a lost love. He goes to the criminal underworld and asks himself, why beat them, when he can join them?"
The Secret Saturdays,7.1,2008-2010,,"Animation, Action, Adventure",TV-Y7,"2,115",An adventuresome family of experts in the field of creatures known as cryptids attempts to protect their secrets and powers from the forces of evil.
Monsuno,4.9,2011- ,,"Animation, Action, Adventure",TV-Y7,557,A group of young friends find monster DNA.
Super Gran,6.4,1985-1987,60,"Comedy, Crime, Family",,500,The adventures of a super-powered granny who fights crime in her community.
T.U.F.F. Puppy,5.5,2010-2015,,"Animation, Short, Action",TV-Y7,"3,374",A secret agent labradoodle is recruited into a task force called T.U.F.F and fights injustice throughout the city in which he lives.
The Mighty B!,5.3,2008-2011,24,"Animation, Short, Comedy",TV-Y7,"2,429","Overachieving Honeybee scout, Bessie Higgenbottom, attempts to earn every last Bee Badge."
Captain Caveman and the Teen Angels,6.4,1977-1980,11,"Animation, Short, Comedy",TV-G,"3,557",The adventures of a superhero caveman and a trio of female amateur detectives.
Buck Rogers,6.6,1950-1951,30,Sci-Fi,,55,A twentieth century football player is swept to the twenty-fifth century and joins the battle against the local despot.
BraveStarr,7.1,1987-1989,30,"Animation, Action, Family",TV-Y7,"2,904",A Native American marshal and his friends keep the peace on the frontier planet of New Texas.
Queen of Swords,7.1,2000-2001,30,"Action, Adventure, Western",,447,"A young woman returns to her home in California after her father's mysterious death. There, she becomes a symbol, the queen of swords, fighting for justice and trying to right the wrongs the colonel has done."
Superman,7.1,1988,30,"Animation, Short, Action",,898,The Man of Steel fights evil in the city of Metropolis and beyond. Each episode ends with a short vignette about key events from Kal-El's youth on Earth.
Transformers: Armada,7.1,2002-2003,30,"Action, Animation, Adventure",TV-Y7,"1,424","The Autobots and the Decepticons are going at it again, but this time the two factions are fighting over little transformers called the Mini-Cons. These Transformers gives their masters a ... See full summary »"
The Adventures of Kid Danger,2.1,2018,30,"Animation, Action, Adventure",TV-Y7,854,The adventures of Ray and Henry continue as they fight old and new criminals in this animated spinoff.
Defenders of the Earth,7.1,1986-1991,30,"Animation, Action, Adventure",TV-Y7,"1,477",Four of the greatest comic strip heroes join forces to battle Ming the Merciless.
WHIH News Front,6.9,2015-2016,9,Sci-Fi,TV-PG,747,"A series of news bulletins on events within the Marvel Cinematic Universe, as presented by reporter Christine Everhart."
Robotboy,5.8,2005-2008,30,"Animation, Action, Comedy",TV-G,"2,173","Robotboy is a cute, cutting-edge, butt-kicking battle-robot, who dreams of becoming a real boy. Created by world-renowned scientist Professor Moshimo, Robotboy has the ability to ... See full summary »"
Marvel Future Avengers,5.8,2017-2018,,"Animation, Action, Adventure",TV-PG,215,"follows a young boy named Makoto, who gains superpowers due to an evil gene manipulation experiment. Makoto and other young kids with powers join the Avengers as apprentices named ""Future Avengers."""
Famalam,6.3,2018- ,20,Comedy,,366,"A zany, new comedy sketch show featuring an array of oddball characters and off-the-wall situations ranging from a misunderstood superhero to Croydon's leading witch-doctor."
Ozzy & Drix,6.9,2002-2003,30,"Animation, Short, Action",TV-Y7,"1,308",The further adventures of Osmosis Jones (Phil LaMarr) and Drix (Jeff Bennett) as they defend the body of a young boy.
Kamen Rider,7.8,1971-1973,30,"Action, Adventure, Drama",TV-G,290,"A grasshopper-like, motorcycle-riding cyborg (joined by another one later in the show) fights the evil organization that transformed him for their evil deeds."
Gargoyles: The Goliath Chronicles,7.8,1996-1997,30,"Animation, Action, Crime",TV-Y7,"2,310",The Manhattan Clan fight for justice and human acceptance in New York City.
The Legend of Prince Valiant,7.4,1991-1994,22,"Animation, Action, Adventure",,702,"After his castle is taken over, Valiant, Prince of Thule, has a dream, in which King Arthur calls him to Camelot. Valiant heeds the advice of the dream, and sets out on a quest to find the ... See full summary »"
Power Rangers HyperForce,6.3,2017-2018,180,"Action, Adventure, Fantasy",TV-PG,188,"Set in the year 3016 at Time Force Academy, a team of Time Force cadets and a beat Time Force Officer must band together when their mentor, Jen Scott ( The Pink Time Force Ranger), and the ... See full summary »"
Ghostforce,6.3,2021- ,22,"Animation, Action, Adventure",TV-Y7,57,"They are here, hidden in everyday objects, in an eternal slumber. Three high school kids working as a team of superheroes, the Ghostforce, secretly fight against the ghosts that haunt their town."
The New Scooby and Scrappy-Doo Show,6.5,1983-1984,30,"Animation, Action, Adventure",,"1,689","Reporter Daphne hires Scooby, Scrappy and Shaggy as her assistants to solve spooky mysteries."
Centurions,7.7,1986,30,"Animation, Action, Family",TV-Y7-FV,"1,912",The adventures of a unit of elite soldiers who wear special frames that accept various weapons and transportation equipment teleported from a space station.
Inspector Gadget,4.7,2015-2018,22,"Animation, Action, Adventure",TV-Y7,602,"When Dr. Claw returns, Inspector Gadget is brought out of retirement to defeat him again, now with Penny and Brain's open participation."
Batman Beyond,6.7,2015- ,,"Action, Sci-Fi",,160,"Bruce Wayne passes the torch of BATMAN to Terry McGinnis in the futuristic megalopolis, Neo-Gotham."
Street Fighter II: V,7.5,1995-1998,22,"Animation, Action, Adventure",TV-Y7,"2,244","Based off of the video game, on an island off the coast of Japan, Ryu, a martial artist, was given an invitation and some American money from his friend Ken Masters, telling him to come to ... See full summary »"
