show_title,imdb_rating,release_year,runtime,genre,parental_guideline,imdb_votes,synopsis
Star Trek: The Animated Series,7.4,1973-1975,30,"Animation, Action, Adventure",TV-Y7,"6,777","The further adventures of Captain James T. Kirk and the crew of the USS Enterprise, as they explore the galaxy and defend the United Federation of Planets."
My Hero,6.6,2000-2007,30,"Comedy, Fantasy, Romance",,"1,909","Thermoman is a multiple-powered superhero who originates from the planet Ultron. In an attempt to do his best to fit in with life on earth, he creates the human alias of George Sunday."
Sonic X,6.3,2003-2006,30,"Animation, Action, Adventure",TV-Y7,"4,350","A slight malfunction causes Chaos Control, and sends Sonic the Hedgehog to Earth. While there, Sonic meets Chris Thorndyke, who aids at collecting the Chaos Emeralds, so Sonic and friends can go home."
NightMan,5.9,1997-1999,45,"Action, Adventure, Drama",TV-14,768,"Based on the comic created by Steve Englehart (who wrote several episodes), Night Man tells the story of Johnny Domino, a jazz musician who gains super powers after getting struck by lightning."
The Tick,7.8,2001-2002,23,"Action, Comedy, Sci-Fi",TV-G,"5,285","The story of superhero The Tick, based on the popular comic book."
SuperMansion,7.6,2015-2019,30,"Animation, Comedy",TV-14,"1,157","Aging superhero, Titanium Rex, and his has-been team known as The League of Freedom struggle to stay relevant in a changing world."
Thunderbirds,7.9,1965-1966,50,"Animation, Action, Adventure",TV-G,"4,363","In the year 2065, the Tracy family run International Rescue - a top-secret organization whose ongoing mission is to rescue people trapped in extraordinarily dangerous situations."
Dragon Ball GT,6.8,1996-2003,24,"Animation, Action, Adventure",TV-PG,"26,044","After Goku is made a kid again by the Black Star Dragon Balls, he goes on a journey to get back to his old self."
Generator Rex,7.7,2010-2013,24,"Animation, Action, Adventure",TV-PG,"5,494","In a future where humans are infected by untested, microscopic robots, a young man with the ability to control the bots helps a government agency control the tech's vicious creations."
Guardians of the Galaxy,7.3,2015-2019,22,"Animation, Action, Adventure",TV-Y7,"3,007",The adventures of a band of space warriors who work to protect the universe from the evil overlord Thanos.
Witchblade,6.5,2001-2002,60,"Action, Drama, Fantasy",,"2,606",NYPD Det. Sara Pezzini has a supernatural weapon and abilities to help her fight evil.
Power Rangers Samurai,5.1,2011-2012,22,"Action, Adventure, Comedy",TV-Y7,"2,186",Five teenagers inherit samurai powers from ancient Japan to protect the world from an army of monsters.
The Green Hornet,7.4,1966-1967,99,"Action, Adventure, Crime",TV-PG,"2,884",A newspaper publisher and his Asian valet/martial arts expert battle crime as the feared Green Hornet and Kato.
Æon Flux,7.8,1991-1995,30,"Animation, Adventure, Sci-Fi",TV-MA,"6,176","Æon Flux is a mysterious and amoral secret agent from the country of Monica. Her motives or background are left unexplained, as are those of her antagonist/love, Trevor Goodchild. On her ... See full summary »"
Mortal Kombat: Conquest,6.3,1998-1999,40,"Action, Adventure, Fantasy",TV-PG,"4,704","Kung Lao has triumphed in the Mortal Kombat tournament, defeating Shang Tsung and saving Earth Realm. Now, he must train a new generation of warriors for the next tournament."
X-Men: Evolution,7.8,2000-2003,23,"Animation, Action, Drama",TV-Y7,"11,650","This rendition of X-Men features Cyclops, Jean Grey, Rogue, Nightcrawler, Shadowcat and Spike as teenagers as they fight for a world that fears and hates them."
Man from Atlantis,6.5,1977-1978,60,"Adventure, Fantasy, Sci-Fi",,"2,369","The adventures of an amphibious man, the last survivor of the legendary sunken city."
My Secret Identity,7.3,1988-1991,25,"Action, Adventure, Comedy",,"1,307",The adventures of a superpowered teen and his scientist friend.
The Tomorrow People,7.3,1973-1979,30,"Drama, Fantasy, Sci-Fi",,709,A group of teens with psychic and other paranormal abilities use their special gifts to battle evil.
Captain Planet and the Planeteers,6.7,1990-1996,23,"Animation, Short, Action",TV-Y7,"11,539",A quintet of teenagers work together to encourage environmentally responsible behavior and can summon a superhero to deal with ecological disasters.
She-Ra: Princess of Power,6.9,1985-1987,22,"Animation, Action, Adventure",TV-Y7,"6,007","Princess Adora raises her magic sword and becomes She-Ra, the most powerful woman in the universe, to aid her friends in defeating the Evil Horde so their planet Etheria can be free."
Thundercats,7.8,2011-2012,,"Animation, Action, Adventure",TV-PG,"7,023","After his home kingdom is destroyed by the ancient devil priest Mumm-Ra, the young Thundercat Lord Lion-O leads a team of survivors as they fight evil on Third Earth."
Static Shock,7.3,2000-2004,30,"Animation, Action, Adventure",TV-Y7,"5,753","In the city of Dakota, a teenage boy with electricity based powers, with the help of his inventive friend, fights crime as a superhero."
W.I.T.C.H.,7.3,2004-2006,30,"Animation, Action, Adventure",TV-Y7,"3,520","Five teenage girls learn that they have been chosen to guard the walls between parallel universes. For this purpose, they have been given the powers of the elements."
Kung Fu Panda: Legends of Awesomeness,7.1,2011-2016,22,"Animation, Action, Adventure",TV-Y7,"6,159",The further adventures of Po the Dragon Warrior and his friends.
RoboCop,5.7,1994,90,"Action, Adventure, Crime",TV-14,"2,408","Alex Murphy is RoboCop, a cybernetic policeman. A creation of a vast corporation, he fights crime and occasional corporate conspiracy in the near-future of Old Detroit."
Power Rangers S.P.D.,6.7,2005,22,"Action, Adventure, Sci-Fi",TV-Y7,"3,038","When the Earth is threatened by the evil Troobian empire, the SPD (Space Patrol Delta) police force recruits a team of Power Rangers to help defend the planet."
Monkey,8.4,1978-2004,,"Action, Family, Adventure",,"1,753",An adaptation of a Chinese folktale about a pilgrimage to the West undertaken by a monk and his divine guardians.
Fat Albert and the Cosby Kids,6.8,1972-1985,30,"Animation, Comedy, Family",TV-Y7,"2,308",The educational adventures of a group of Afro-American inner city kids.
Jonny Quest,7.8,1964-1965,30,"Animation, Action, Adventure",TV-Y7,"4,650",The Quest family and their bodyguard investigate strange phenomena and battle villains around the world.
Black Scorpion,6.2,2001,,"Action, Crime, Drama",TV-PG,507,"The City of Angels is falling apart, and crime pervades the city to the core. The mayor is corrupt, the police are inept, the city needs a figure to take control of the situation. Then in ... See full summary »"
Space Ghost Coast to Coast,7.9,1993-2012,15,"Animation, Comedy, Sci-Fi",,"6,980","Space Ghost, a superhero from a 1960s Hanna-Barbara cartoon, hosts his own talk show."
Darker Than Black,7.7,2007-2010,24,"Animation, Action, Drama",TV-MA,"11,586","In Tokyo, an impenetrable field known as ""Hell's Gate"" appeared ten years ago. At the same time, psychics who wield paranormal powers at the cost of their conscience also emerged. Hei is ... See full summary »"
Baymax!,,2022- ,,"Animation, Action, Adventure",,,"The characters in the unique city of Big Hero 6 get their own series, packed with adventures."
Wolverine and the X-Men,8,2008-2009,23,"Animation, Action, Adventure",TV-Y7,"10,816","After an explosion at the school, the X-Men went their separate ways. But they must unite once again under the leadership of Wolverine to prevent an inevitable war while also dealing with present problems."
Super Friends,7.3,1973-1985,60,"Animation, Action, Adventure",TV-G,"2,426",The greatest of the DC Comics superheroes work together to uphold the good with the help of some young proteges.
Power Rangers Dino Charge,6.5,2015-2016,21,"Action, Adventure, Family",TV-Y7,"1,316","On prehistoric Earth, an alien entrusted powerful Energems to 10 dinosaurs, but when the dinosaurs went extinct, the Energems were lost. Now an intergalactic bounty hunter is determined to ... See full summary »"
Street Hawk,6.8,1985,60,"Action, Crime, Mystery",TV-PG,"3,193",A desk bound cop secretly fights crime as the test pilot for a prototype combat motorcycle.
Thunderbirds Are Go,6.8,2015-2020,22,"Animation, Action, Adventure",TV-G,"1,632","In the future, the Tracy family run a private mechanized emergency response service."
Green Lantern,Not-Rated,TBA,,"Action, Adventure, Drama",,,Series based on the DC comics' Green Lantern characters.
Manimal,6.5,1983,60,"Adventure, Crime, Fantasy",TV-PG,"1,937",A man who can change himself into any animal fights crime.
Darkwing Duck,7.6,1991-1992,30,"Animation, Action, Adventure",TV-Y7,"15,974",A bumbling superhero battles crime with the help of his daughter and pilot sidekick.
Black Dynamite,8.1,2011-2015,22,"Animation, Action, Adventure",TV-MA,"4,409","Action comedy-spoof that follows ex-C. I. A. Agent and full-time ladies man, Black Dynamite, who's out to avenge the death of his brother against kung-fu masters, drug-dealing pimps, and The Man."
Power Rangers Lost Galaxy,6.9,1999-2000,30,"Action, Adventure, Family",TV-Y7,"2,321",Power-Packed Adventure! Action-Packed Fun! A time in the future. The space colony Terra Venture journeys beyond Earth in search of new worlds. Peace reigns throughout the cosmos...or does ... See full summary »
Spider-Man,7.4,1967-1970,25,"Animation, Action, Adventure",TV-Y7,"3,624","Original cartoon series based on the web-slinging Marvel comic book character, Peter Parker, who, after being bit by a radioactive spider, assumes extraordinary powers."
"Harvey Birdman, Attorney at Law",8,2000-2007,15,"Animation, Comedy, Sci-Fi",TV-14,"11,381",Third-rate superhero Harvey Birdman gets a new lease on life when he becomes a lawyer.
ReBoot,7.8,1994-2001,30,"Animation, Short, Action",TV-Y7,"5,361","In the inner computer world of Mainframe, a guardian program sprite and his friends defend the system from threats from viruses and the User."
Spider-Man,7,2003,21,"Animation, Action, Adventure",TV-PG,"5,281",A young man with spider like abilities fights crime as a superhero in New York City while trying to have a normal personal life.
Powerless,6.4,2017,21,"Comedy, Fantasy, Sci-Fi",,"6,925","Follow the staff of an insurance company, specialising in products to protect defenseless bystanders from the collateral damage of Superheroes and Supervillains."
"Be Cool, Scooby-Doo!",6.3,2015-2018,23,"Animation, Adventure, Comedy",TV-Y7-FV,"2,180","The Scooby gang continues to solve mysteries during what could be their last summer together, but monsters and ghouls get in the way of completing their adventures."
Sonic the Hedgehog,6.8,1993-1994,30,"Animation, Short, Action",TV-Y7-FV,"4,975","In a post-apocalyptic and dystopian future, all life has been challenged by oppression and tyranny, as the evil Dr. Robotnik is on the wake of controlling Mobius."
Dungeons & Dragons,8,1983-1985,30,"Animation, Adventure, Comedy",TV-Y7,"5,003","A group of kids are thrown into a fantasy world where they must search for a way home, armed with magic weapons that an evil tyrant wants."
Voltron: Defender of the Universe,7.9,1984-1985,24,"Animation, Family, Sci-Fi",TV-Y7,"4,688",This series focuses on five lion robots and their pilots as they fight the evil forces of King Zarkon and Prince Lotor.
The Powerpuff Girls,3.4,2016-2019,60,"Animation, Action, Comedy",TV-Y7-FV,"4,147","Made from sugar, spice, everything nice and Chemical X by the Professor; Blossom, Bubbles, and Buttercup now use their superpowers and super cuteness to save the world (or at least Townsville) from evil villains and all things icky."
Power Rangers in Space,7.3,1998-1999,30,"Action, Adventure, Family",TV-Y7,"3,168","The most evil forces of the universe (Rita & Zedd, the Machine Empire and Divatox) have formed an alliance with the monarch of all evil, Dark Specter. With Zordon as his prisoner, Dark ... See full summary »"
Sailor Moon Crystal,7.9,2014- ,24,"Animation, Action, Adventure",TV-14,"2,076",Usagi Tsukino is chosen to be a guardian of justice and is sent on a quest to locate a Silver Crystal before the Dark Kingdom invades the Earth.
The Secrets of Isis,6.8,1975-1976,30,"Adventure, Family, Fantasy",,"1,056",An archaeologist gains an amulet that allows her to transform into the superheroine goddess Isis and fight evil.
Lab Rats: Elite Force,6.5,2016-2019,30,"Adventure, Comedy, Drama",TV-Y7,"1,348","When Mighty Med hospital is destroyed, bionic heroes Bree and Chase join superheroes Kaz, Oliver, and Skylar to form an Elite Force and take down those responsible for the attack."
Power Rangers Time Force,7.1,2001,30,"Action, Adventure, Crime",TV-Y7,"2,364",The Time Force Power Rangers travel to the past to stop Ransik and his band of criminal mutants.
Speed Racer,7.2,1967-1968,30,"Animation, Action, Adventure",TV-Y7,"2,890","Teenager Gô Mifune aspires to be the world's best race-car champion with the help of his friends, family and his father's high-tech race-car, the Mach 5."
TRON: Uprising,8.2,2012-2013,30,"Animation, Action, Adventure",TV-Y7,"8,146","In the computer world of the Grid, a young program joins Tron's fight against their world's tyranny."
Birdgirl,5.7,2021- ,,"Animation, Adventure, Comedy",TV-14,696,"After being named CEO of the world's largest and most non-sensical corporation, Sebben & Sebben, Judy Ken Sebben aka Birdgirl has to find a way to maintain her work/superhero life balance."
Ghostbusters,6.4,1986-1987,25,"Animation, Adventure, Comedy",TV-Y7,"2,929",A squad of supernatural investigators are Earth's only defense against an evil ghost wizard and his minions.
Power Rangers DinoThunder,6.8,2004,30,"Action, Adventure, Sci-Fi",TV-Y7,"3,037","An eccentric scientist and his partner, veteran Power Ranger Dr. Tommy Oliver, have created Dinosaur like robots called Bio Zords. After their laboratory is attacked by the evil Mesogog, ... See full summary »"
Iron Man: Armored Adventures,6.5,2008-2012,22,"Animation, Action, Adventure",TV-Y7,"3,481",A teenage Tony Stark battles evil with his revolutionary power armor technology.
The New Avengers,7.2,1976-1977,60,"Action, Mystery, Thriller",,"2,310","Secret agent Steed, working for an unnamed branch of British intelligence, is teamed up with two partners to fight evil plots for world domination, dealing with suspended animation, biological warfare, robotics, and other threats."
Power Rangers Megaforce,5.7,2000-2014,24,"Action, Adventure, Family",TV-Y7,"1,611",An evil galactic armada has come to destroy the planet Earth and the newest team of Power Rangers must harness powers from Rangers of the past to stop them as the Power Rangers Megaforce.
Bionic Woman,5.8,2007,60,"Action, Sci-Fi, Thriller",TV-PG,"8,183",A reimagining of the popular 1970s TV series about a female athlete who is given bionic strength.
OK K.O.! Let's Be Heroes,6.4,2017-2019,11,"Animation, Short, Action",TV-Y7-FV,"2,786","An enthusiastic young boy earns a job at a hero supply store and trains to become the ""Greatest Hero Ever."""
Constantine: City of Demons,7.6,2018-2019,6,"Animation, Short, Action",R,"5,886",An animated series centering on the adventures of supernatural detective John Constantine.
Spider-Man Unlimited,6.4,1999-2005,22,"Animation, Action, Adventure",TV-Y7,"3,255",Spider-Man travels to Counter-Earth to rescue a Terran shuttle crew trapped there and discovers a tyrannical and warped version of his world.
The New Scooby-Doo Movies,7.7,1972-1973,83,"Animation, Adventure, Comedy",TV-G,"4,759",The Mystery Inc. gang investigate more supernatural sightings with various guest stars and characters.
Ghost in the Shell SAC_2045,6.3,2020- ,25,"Animation, Action, Crime",TV-MA,"1,958","Hired as a mercenary unit, the former members of Japan's elite Section 9 are faced with the sudden appearance of ""Post-Human,"" a being with tremendous intelligence and physical capabilities."
Judge Dredd: Mega City One,Not-Rated,TBA,,"Action, Adventure, Crime",,,"Judge Dredd patrols an over-populated metropolis in the 22nd Century, where he has the powers of a judge, jury and executioner."
Johnny Test,5.2,2005- ,30,"Animation, Action, Adventure",TV-Y7,"8,044","The adventures of average suburban boy Johnny Test, who wittingly plays test subject for his genius twin sisters' various experiments, reluctantly fighting evil villains in the process."
Team Umizoomi,6.1,2010-2015,24,"Animation, Family",TV-Y,863,"Umifriend, Team Umizoomi needs your help! Build a super fast speedboat with shapes. Use pattern power to make chocolate and strawberry milk. Fix a broken subway train and so much more with these tiny super heroes!"
The Super Mario Bros. Super Show!,6.4,1989,30,"Animation, Action, Adventure",TV-Y7,"4,089","The Mario Brothers, Princess Toadstool, and Toad go on various adventures while battling the evil King Koopa."
Danger Mouse,7,2015-2019,22,"Animation, Action, Adventure",TV-Y7,556,The continuing adventures of secret agent Danger Mouse and his sidekick Penfold.
Power Rangers R.P.M.,6.6,2009,22,"Action, Adventure, Comedy",TV-Y7,"1,700","In the near future, the mysterious and sinister Venjix Computer Network is attempting to conquer and lay ruin to the entire planet. Mankind has retreated into environmentally-shielded domed... See full summary »"
Legends of the Superheroes,5.8,1979,100,"Action, Comedy, Adventure",,526,"A teamup of some of DC Comics' greatest superheroes together, for 2 specials: a race to stop the united supervillains' plot to destroy the earth, then later a roast in tribute to all of the heroes hosted by Ed McMahon."
Mad,5.8,2010-2013,12,"Animation, Comedy",TV-PG,"2,877",The animated version of the classic humor magazine satirizes current pop culture.
Superhero Kindergarten,7,2021- ,,"Animation, Action, Family",TV-Y7,201,"A gym coach acquires incredible superpowers from a mysterious comet and becomes Captain Fantastic, one of the earth's greatest protectors. He works 'undercover' as a kindergarten teacher to raise a new generation of super-powered kids."
Spider-Man and His Amazing Friends,7.2,1981-1986,22,"Animation, Action, Comedy",TV-Y7,"3,394",Spider-Man battles crime in New York City with the help of Iceman and Firestar.
Automan,6.9,1983-1984,70,"Adventure, Comedy, Crime",,"1,836",A computer-generated superhero and his human creator fight crime in the city.
The Incredible Hulk,6.8,1996-1998,20,"Animation, Action, Adventure",TV-Y7,"3,233",A nuclear scientist is afflicted with the tendency to change into a powerful green monster under stress.
Code Lyoko,7.3,2003-2007,26,"Animation, Action, Adventure",TV-Y7,"5,018","When a group of four boarding school students discover a supercomputer housed inside an abandoned factory, they find a virtual world called Lyoko and awaken a sentient multi-agent system virus that tries to take over the real world."
He-Man and the Masters of the Universe,7.5,2002-2004,30,"Animation, Action, Adventure",TV-Y7,"3,249","On the planet Eternia, a young prince gains the ability to become a powerful warrior to defend Castle Grayskull against the dark lord Skeletor."
The Tick,7.8,1994-1997,30,"Animation, Action, Adventure",TV-Y7,"9,455","An invulnerable, somewhat dim, superhero protects The City from all manner of evil-doers."
MASK,7.2,1985-1986,22,"Animation, Action, Adventure",TV-Y7,"4,119",Matt Trakker leads a special team of masked crime fighters with a fleet of hidden function vehicles against Miles Mayhem and his criminal organization known as V.E.N.O.M.
The Sentinel,6.6,1996-1999,45,"Action, Adventure, Crime",,"2,333","In the jungles of Peru, the fight for survival heightened his senses. Now, Detective Jim Ellison is a sentinel in the fight for justice. Anthropologist Blair Sandburg works side by side with Jim, helping him develop these senses."
Spider Man,6.4,1978-1979,30,"Action, Adventure, Family",TV-PG,497,Motorcyclist Takuya Yamashiro fights the evil forces of Professor Monster as the superhero Spiderman.
Power Rangers Zeo,6.6,1996-1997,21,"Action, Adventure, Family",TV-Y7,"2,676","Tommy, Billy, Adam, Rocky, Kat and Tanya are turned back to their teenage forms thanks to the Zeo Crystal. The Command Center is gone but the crystal leads them to the new Power Chamber and all but Billy take on new Zeo powers."
Misfits of Science,7.4,1985-1986,60,"Adventure, Comedy, Sci-Fi",,"1,067",The adventures of a team of misfit superheroes who fight crime for a scientific think tank.
The Master,4.5,1984,60,"Adventure, Drama, Action",,"1,406",An aging American ninja master and his headstrong young apprentice search for the elder man's daughter.
The Cape,5.8,2011,60,"Action, Drama",TV-14,"8,439","Vince Faraday is a cop who has been framed for murder, leading him to fall off the grid and become the super hero known only as ""The Cape."""
Power Rangers Jungle Fury,6.6,2008,22,"Action, Adventure, Drama",TV-Y7,"1,717",Three teenagers from the Pai Zhug Kung Fu Academy are chosen to fight the forces of an opposing academy and all other forces of evil.
Power Rangers Mystic Force,6.7,2006,22,"Action, Adventure, Family",TV-Y7,"2,608","Legend says when the darkness arises, five brave teen sorcerers will be called to fight for the planet's survival - with the guidance from their wise mentor and the ancient Xenotome, book ... See full summary »"
Power Rangers Wild Force,6.3,2002-2003,30,"Action, Adventure, Drama",TV-Y7,"2,379","Five teenagers are chosen by five Power Animals to become the Wild Force Rangers, to fight the evil Jinderax and Toxica and their evil Orgs."
Power Rangers Ninja Storm,6.4,2003-2004,30,"Action, Adventure, Family",TV-Y7,"2,517",A trio of ninja trainees become Power Rangers to defend their school after it is attacked by aliens.
Werewolf,8,1987-1988,30,"Horror, Thriller",,878,"Young Eric has been bitten by a werewolf. However, he's not particularly thrilled by this turn of affairs and wishes to escape his curse. To do so, he must find and kill the founder of his ... See full summary »"
The Champions,7.6,1968-1969,60,"Adventure, Sci-Fi, Thriller",,"1,195","After a plane carrying three UN Agents crashes in the Himalayas, they are rescued by an advanced civilisation secretly living in Tibet who grant them enhanced versions of the ordinary five senses, and intellectual and physical abilities."
The Awesomes,7.3,2013-2015,23,"Animation, Action, Comedy",TV-14,"1,429","After the legendary Mr. Awesome retires as leader of his superhero task force, his not-so-super son Prock must assemble a team of funny-if-flawed misfits to restore the group to its former glory."
Iron Man,6.7,1994-1996,30,"Animation, Action, Adventure",TV-Y7,"3,212",Industrialist Tony Stark leads his private team of superheros as Iron Man against the forces of evil.
Beware the Batman,7.3,2013-2014,22,"Animation, Action, Adventure",TV-PG,"4,176","Batman, a crime-fighting vigilante of Gotham City, goes up against the underworld."
Electra Woman and Dyna Girl,6.8,1976,24,Sci-Fi,,434,The adventures of two female superheroes.
Star Wars: Droids,6,1985-1986,,"Animation, Action, Adventure",,"1,719",The adventures of R2-D2 and C-3PO years before serving the Rebel Alliance. The series features several story arcs and one hour-long special.
The Invisible Man,7.5,2000-2002,120,"Action, Comedy, Sci-Fi",,"3,172","A thief and conman is given the means to become invisible, and ends up working for a government agency."
Vixen,7.1,2015-2016,5,"Animation, Short, Action",TV-PG,"3,473","Vixen is based on the DC Character Mari McCabe / Vixen, a costumed superhero crime-fighter with the power to mimic the abilities of any animal that has ever lived on Earth."
The Epic Tales of Captain Underpants,6.7,2018-2020,24,"Animation, Short, Action",TV-Y7,860,"Best friends George and Harold scheme together a number of pranks at school involving their principal, whose alter ego is a superhero they created called Captain Underpants."
Freakazoid!,7.5,1995-1997,30,"Animation, Short, Action",TV-G,"7,832","Washington, D.C. has a new defender: Freakazoid. The comedy and insanity never stop when he's around, and he's only one of the weird heroes of the series. It's better than a nice tub of good things."
Danger Mouse,7.4,1981-1992,25,"Animation, Comedy, Family",TV-Y,"3,467","Danger Mouse, the greatest secret agent in the world, must follow Colonel K's orders (and try not to break Professor Squawkencluck's inventions) to foil Baron Greenback's and his henchman Stiletto's plans."
Blue Thunder,6.2,1984,60,"Action, Crime, Drama",,"1,848",An advanced prototype police helicopter and their ground support crew battle crime.
Xiaolin Showdown,7.4,2003-2006,30,"Animation, Action, Adventure",TV-Y7,"7,054",A young Xiaolin monk named Omi with a giant yellow head leads a trio of other students to collect powerful items known as Shen Gong Wu while battling the evil Jack Spicer who is also after the artifacts
Mummies Alive!,7.1,1997-1998,30,"Animation, Action, Adventure",TV-Y7,"1,289","In present day US, a kid releases four ancient Egyptian mummy warriors who help him fight a revived Egyptian evil mummy sorcerer who wants to take over the world."
Wolverine: Lost Chapters,7.4,2019- ,28,Action,,16,"After being shot in the head with an Adamantium bullet, Logan awakens with Amnesia and more questions than answers. These are the lost chapters of Logan's story, his dark and gritty journey... See full summary »"
Fist of the North Star,8.3,1984-1988,25,"Animation, Action, Adventure",TV-14,"3,029","In the year 199X, human civilization has been all but destroyed by a nuclear holocaust. In an age where the strong rule over the weak, the survivors of the fallout struggle over the ... See full summary »"
The Scooby-Doo/Dynomutt Hour,7.6,1976-1978,24,"Animation, Adventure, Comedy",TV-G,"3,290",Scooby Doo and the gang solve mysteries; then Blue Falcon and Dynomutt fight crime in each two-part episode of this animated series.
